{
  "$schema": "https://json-schema.org/draft/2020-12/schema",
  "$id": "ars://evals/heldout/review_criteria_constructive_value/subject_output.schema.json",
  "title": "Review-criteria constructive-value subject output",
  "type": "object",
  "additionalProperties": false,
  "required": ["schema_version", "item_id", "consumer_id", "role", "profile", "applicability", "findings"],
  "properties": {
    "schema_version": {"const": "review-criteria-subject-output/1.0"},
    "item_id": {"type": "string", "pattern": "^RCV-0[1-6]$"},
    "consumer_id": {"enum": ["formative_planning", "internal_evaluator", "external_panel"]},
    "role": {"enum": ["FORMATIVE", "INTERNAL", "EIC", "R1", "R2", "R3", "DA"]},
    "profile": {
      "type": "object",
      "additionalProperties": false,
      "required": ["resolved_digest", "selected_criterion_ids"],
      "properties": {
        "resolved_digest": {"type": "string", "pattern": "^[0-9a-f]{64}$"},
        "selected_criterion_ids": {
          "type": "array",
          "uniqueItems": true,
          "items": {"type": "string", "pattern": "^[a-z0-9][a-z0-9._-]*$"}
        }
      }
    },
    "applicability": {
      "type": "array",
      "items": {
        "type": "object",
        "additionalProperties": false,
        "required": ["criterion_id", "predicted", "rationale"],
        "properties": {
          "criterion_id": {"type": "string", "pattern": "^[a-z0-9][a-z0-9._-]*$"},
          "predicted": {"enum": ["applicable", "not_applicable", "unresolved"]},
          "rationale": {"type": "string", "minLength": 1, "maxLength": 1200}
        }
      }
    },
    "findings": {
      "type": "array",
      "maxItems": 8,
      "items": {
        "type": "object",
        "additionalProperties": false,
        "required": [
          "finding_id", "predicted_severity", "criterion_ids", "evidence_anchor",
          "scholarly_relevance", "predicted_venue_alignment", "remedy"
        ],
        "properties": {
          "finding_id": {"type": "string", "pattern": "^[A-Za-z0-9][A-Za-z0-9._-]{0,127}$"},
          "predicted_severity": {"enum": ["critical", "major"]},
          "criterion_ids": {
            "type": "array",
            "minItems": 1,
            "uniqueItems": true,
            "items": {"type": "string", "pattern": "^[a-z0-9][a-z0-9._-]*$"}
          },
          "evidence_anchor": {
            "type": "object",
            "additionalProperties": false,
            "required": ["locator", "claim"],
            "properties": {
              "locator": {"type": "string", "minLength": 1, "maxLength": 300},
              "claim": {"type": "string", "minLength": 1, "maxLength": 1200}
            }
          },
          "scholarly_relevance": {"type": "string", "minLength": 1, "maxLength": 1200},
          "predicted_venue_alignment": {"enum": ["aligned", "not_aligned", "not_claimed"]},
          "remedy": {
            "type": "object",
            "additionalProperties": false,
            "required": [
              "status", "minimum_action", "effort_scope", "cost_tradeoffs",
              "changes_research_intent", "requires_new_data",
              "proposed_result_values", "no_honest_reason"
            ],
            "properties": {
              "status": {"enum": ["available", "none"]},
              "minimum_action": {"type": ["string", "null"], "minLength": 1, "maxLength": 1200},
              "effort_scope": {"enum": ["sentence", "section", "re_analysis", "new_data", "other", "none"]},
              "cost_tradeoffs": {"type": "string", "maxLength": 1200},
              "changes_research_intent": {"enum": ["no", "yes_author_choice_required", "uncertain_author_choice_required", "not_applicable"]},
              "requires_new_data": {"type": "boolean"},
              "proposed_result_values": {"type": "boolean"},
              "no_honest_reason": {"type": ["string", "null"], "minLength": 1, "maxLength": 1200}
            }
          }
        }
      }
    }
  }
}
