{
  "applicability": [
    {
      "criterion_id": "official.example.format",
      "predicted": "unresolved",
      "rationale": "No submission package or required-declaration information is provided in the manuscript material."
    },
    {
      "criterion_id": "official.example.scope",
      "predicted": "applicable",
      "rationale": "The abstract describes an empirical learning-analytics article, which is within the declared contribution framing."
    },
    {
      "criterion_id": "field.computing.transparency",
      "predicted": "applicable",
      "rationale": "The methods state that feature definitions and code are documented, directly addressing implementation choices relevant to the stated model claim."
    },
    {
      "criterion_id": "field.education.context",
      "predicted": "applicable",
      "rationale": "The manuscript concerns three classroom settings, and its methods and limitations identify site-level differences relevant to interpretation."
    },
    {
      "criterion_id": "broad.synthetic.claims",
      "predicted": "applicable",
      "rationale": "The article makes a pooled main conclusion from evidence collected across multiple classroom settings."
    }
  ],
  "consumer_id": "external_panel",
  "findings": [
    {
      "criterion_ids": [
        "field.education.context",
        "broad.synthetic.claims"
      ],
      "evidence_anchor": {
        "claim": "The pooled main conclusion is insufficiently contextualized for the documented site differences.",
        "locator": "Methods: classroom implementation differs by site and one site omits support after an alert; Results: sites are pooled for the main conclusion with no site-specific calibration table; Limitations: institutional variation is not connected to delivery or interpretation."
      },
      "finding_id": "F1",
      "predicted_severity": "major",
      "predicted_venue_alignment": "aligned",
      "remedy": {
        "changes_research_intent": "no",
        "cost_tradeoffs": "Requires additional analysis and reporting space; more qualified interpretation may narrow the scope of the pooled conclusion.",
        "effort_scope": "re_analysis",
        "minimum_action": "Report the documented site-level implementation and institutional context, analyze or present existing site-level performance information where feasible, and revise the pooled interpretation to state the limits imposed by those differences.",
        "no_honest_reason": null,
        "proposed_result_values": false,
        "requires_new_data": false,
        "status": "available"
      },
      "scholarly_relevance": "Without linking site context to the pooled interpretation, readers cannot determine whether the conclusion is appropriately supported across the classroom settings."
    }
  ],
  "item_id": "RCV-05",
  "profile": {
    "resolved_digest": "f92c2213d26eec2cf77eb3a6b4036dd441c712d4c399f19acdb11d134543ebc8",
    "selected_criterion_ids": [
      "official.example.format",
      "official.example.scope",
      "field.computing.transparency",
      "field.education.context",
      "broad.synthetic.claims"
    ]
  },
  "role": "R3",
  "schema_version": "review-criteria-subject-output/1.0"
}
