{
  "applicability": [
    {
      "criterion_id": "official.example.format",
      "predicted": "applicable",
      "rationale": "This submission-readiness criterion is selected for the stated target, but the supplied record provides no formatting requirements to assess."
    },
    {
      "criterion_id": "official.example.scope",
      "predicted": "applicable",
      "rationale": "This venue-fit criterion is selected for the stated target, but the supplied record provides no scope requirements to assess."
    },
    {
      "criterion_id": "field.computing.transparency",
      "predicted": "applicable",
      "rationale": "The manuscript reports methods, limitations, and data availability relevant to transparent reporting."
    },
    {
      "criterion_id": "broad.synthetic.claims",
      "predicted": "applicable",
      "rationale": "The title, abstract, and results make strong conclusions that require calibration to the reported evidence."
    }
  ],
  "consumer_id": "internal_evaluator",
  "findings": [
    {
      "criterion_ids": [
        "broad.synthetic.claims"
      ],
      "evidence_anchor": {
        "claim": "The manuscript presents a definitive causal conclusion despite alternating enrollment allocation, an unadjusted comparison selected after inspecting distributions, and an interval that includes zero.",
        "locator": "manuscript.methods; manuscript.results; manuscript.abstract"
      },
      "finding_id": "F1",
      "predicted_severity": "critical",
      "predicted_venue_alignment": "not_claimed",
      "remedy": {
        "changes_research_intent": "no",
        "cost_tradeoffs": "The central conclusion and title would need to be narrowed.",
        "effort_scope": "section",
        "minimum_action": "Recast the work as an observational comparison, remove definitive causal language, and state that the reported interval does not establish a conclusive difference.",
        "no_honest_reason": null,
        "proposed_result_values": false,
        "requires_new_data": false,
        "status": "available"
      },
      "scholarly_relevance": "The allocation process and reported uncertainty do not support the manuscript's definitive causal conclusion."
    },
    {
      "criterion_ids": [
        "field.computing.transparency"
      ],
      "evidence_anchor": {
        "claim": "The limitations omit allocation bias, analytic flexibility, and imprecision, although the methods and results identify each concern.",
        "locator": "manuscript.limitations; manuscript.methods; manuscript.results"
      },
      "finding_id": "F2",
      "predicted_severity": "major",
      "predicted_venue_alignment": "not_claimed",
      "remedy": {
        "changes_research_intent": "no",
        "cost_tradeoffs": "A fuller limitations account reduces apparent certainty but makes the report more interpretable.",
        "effort_scope": "section",
        "minimum_action": "Add a limitations discussion covering nonrandom allocation, analysis decisions made after inspecting distributions, and the imprecision indicated by the reported interval.",
        "no_honest_reason": null,
        "proposed_result_values": false,
        "requires_new_data": false,
        "status": "available"
      },
      "scholarly_relevance": "Omitting these design and analysis constraints prevents readers from judging the strength and limits of the reported comparison."
    }
  ],
  "item_id": "RCV-02",
  "profile": {
    "resolved_digest": "16c2281db5d31ff61c3d2eeaf876eda210d2e23bd558b3f8e0afcd210e958f28",
    "selected_criterion_ids": [
      "official.example.format",
      "official.example.scope",
      "field.computing.transparency",
      "broad.synthetic.claims"
    ]
  },
  "role": "INTERNAL",
  "schema_version": "review-criteria-subject-output/1.0"
}
