{
  "applicability": [
    {
      "criterion_id": "official.example.format",
      "predicted": "applicable",
      "rationale": "The selected submission-readiness criterion applies to the manuscript, although the supplied record contains no format-compliance details."
    },
    {
      "criterion_id": "official.example.scope",
      "predicted": "applicable",
      "rationale": "The manuscript concerns learning analytics, consistent with the declared target context."
    },
    {
      "criterion_id": "field.computing.transparency",
      "predicted": "applicable",
      "rationale": "The manuscript reports a computational model and documents feature definitions and code."
    },
    {
      "criterion_id": "field.education.context",
      "predicted": "applicable",
      "rationale": "The study spans classroom settings whose implementation differs by site."
    },
    {
      "criterion_id": "broad.synthetic.claims",
      "predicted": "applicable",
      "rationale": "The manuscript makes a pooled cross-site conclusion from synthetic study materials."
    }
  ],
  "consumer_id": "external_panel",
  "findings": [
    {
      "criterion_ids": [
        "field.education.context",
        "broad.synthetic.claims"
      ],
      "evidence_anchor": {
        "claim": "Implementation differs by site, yet the main conclusion pools sites; the limitations do not connect institutional variation to delivery or interpretation, and no site-specific calibration table is provided.",
        "locator": "manuscript.methods; manuscript.results; manuscript.limitations"
      },
      "finding_id": "F1",
      "predicted_severity": "major",
      "predicted_venue_alignment": "aligned",
      "remedy": {
        "changes_research_intent": "no",
        "cost_tradeoffs": "Requires additional site-stratified reporting and qualification of the pooled interpretation; may make cross-site conclusions more conditional.",
        "effort_scope": "re_analysis",
        "minimum_action": "Report site-specific calibration and describe the site-level implementation differences relevant to interpreting pooled performance; revise the pooled conclusion to reflect any resulting uncertainty.",
        "no_honest_reason": null,
        "proposed_result_values": false,
        "requires_new_data": false,
        "status": "available"
      },
      "scholarly_relevance": "Without linking site context to interpretation of pooled performance, readers cannot determine whether similar discrimination supports a common cross-site interpretation."
    }
  ],
  "item_id": "RCV-05",
  "profile": {
    "resolved_digest": "f92c2213d26eec2cf77eb3a6b4036dd441c712d4c399f19acdb11d134543ebc8",
    "selected_criterion_ids": [
      "official.example.format",
      "official.example.scope",
      "field.computing.transparency",
      "field.education.context",
      "broad.synthetic.claims"
    ]
  },
  "role": "R3",
  "schema_version": "review-criteria-subject-output/1.0"
}
