{
  "applicability": [
    {
      "criterion_id": "official.example.format",
      "predicted": "applicable",
      "rationale": "The manuscript is presented as a synthetic submission package with declarations such as data availability and limitations."
    },
    {
      "criterion_id": "official.example.scope",
      "predicted": "applicable",
      "rationale": "The abstract expressly locates the article within the declared journal scope."
    },
    {
      "criterion_id": "field.computing.transparency",
      "predicted": "applicable",
      "rationale": "The outcome-selection procedure is an implementation choice directly relevant to the article's central claim."
    },
    {
      "criterion_id": "broad.synthetic.claims",
      "predicted": "applicable",
      "rationale": "The discussion generalizes a selected-trial estimate to routine use."
    }
  ],
  "consumer_id": "external_panel",
  "findings": [
    {
      "criterion_ids": [
        "field.computing.transparency",
        "broad.synthetic.claims"
      ],
      "evidence_anchor": {
        "claim": "The reported conclusion relies only on each participant's fastest trial, with the selection rule disclosed only in the discussion; records for all trials remain available, but no all-trial sensitivity analysis is reported.",
        "locator": "Methods; Results; Limitations"
      },
      "finding_id": "F1",
      "predicted_severity": "major",
      "predicted_venue_alignment": "aligned",
      "remedy": {
        "changes_research_intent": "no",
        "cost_tradeoffs": "Requires re-analysis and clearer reporting; estimates may differ and the discussion may need revision.",
        "effort_scope": "re_analysis",
        "minimum_action": "Disclose and justify the selection rule in Methods, analyze all available trial records as a sensitivity analysis, and revise the routine-use interpretation to reflect that analysis and the stated limitations.",
        "no_honest_reason": null,
        "proposed_result_values": false,
        "requires_new_data": false,
        "status": "available"
      },
      "scholarly_relevance": "Selective outcome reporting obscures a claim-relevant analytic choice and leaves the representativeness assertion unsupported. This is a scientific-validity defect separate from the article's stated alignment with the declared scope."
    }
  ],
  "item_id": "RCV-03",
  "profile": {
    "resolved_digest": "16c2281db5d31ff61c3d2eeaf876eda210d2e23bd558b3f8e0afcd210e958f28",
    "selected_criterion_ids": [
      "official.example.format",
      "official.example.scope",
      "field.computing.transparency",
      "broad.synthetic.claims"
    ]
  },
  "role": "EIC",
  "schema_version": "review-criteria-subject-output/1.0"
}
