{
  "applicability": [
    {
      "criterion_id": "official.example.format",
      "predicted": "applicable",
      "rationale": "The record describes a synthetic submission package and provides declarations relevant to availability and protocol adherence."
    },
    {
      "criterion_id": "official.example.scope",
      "predicted": "applicable",
      "rationale": "The manuscript presents an empirical computing study for the declared research-article contribution type."
    },
    {
      "criterion_id": "field.computing.transparency",
      "predicted": "applicable",
      "rationale": "The claimed interpretation depends on reported study and analysis implementation choices."
    },
    {
      "criterion_id": "broad.synthetic.claims",
      "predicted": "applicable",
      "rationale": "The manuscript makes synthetic-evidence claims about the estimated difference and its limits."
    }
  ],
  "consumer_id": "external_panel",
  "findings": [],
  "item_id": "RCV-06",
  "profile": {
    "resolved_digest": "16c2281db5d31ff61c3d2eeaf876eda210d2e23bd558b3f8e0afcd210e958f28",
    "selected_criterion_ids": [
      "official.example.format",
      "official.example.scope",
      "field.computing.transparency",
      "broad.synthetic.claims"
    ]
  },
  "role": "DA",
  "schema_version": "review-criteria-subject-output/1.0"
}
