{
  "applicability": [
    {
      "criterion_id": "official.example.format",
      "predicted": "unresolved",
      "rationale": "No venue-format requirements or paper-visible formatting details are supplied."
    },
    {
      "criterion_id": "official.example.scope",
      "predicted": "unresolved",
      "rationale": "No scope requirements are supplied from which fit can be assessed."
    },
    {
      "criterion_id": "field.computing.transparency",
      "predicted": "applicable",
      "rationale": "The manuscript reports allocation and analytic choices and therefore requires transparent reporting of material limitations."
    },
    {
      "criterion_id": "broad.synthetic.claims",
      "predicted": "applicable",
      "rationale": "The title, abstract, and results make definitive causal claims that can be assessed against the reported design and uncertainty."
    }
  ],
  "consumer_id": "internal_evaluator",
  "findings": [
    {
      "criterion_ids": [
        "broad.synthetic.claims"
      ],
      "evidence_anchor": {
        "claim": "The manuscript makes definitive causal and eliminative claims despite nonrandom alternating allocation and an interval spanning zero.",
        "locator": "manuscript.title; manuscript.abstract; manuscript.methods; manuscript.results"
      },
      "finding_id": "F1",
      "predicted_severity": "major",
      "predicted_venue_alignment": "not_claimed",
      "remedy": {
        "changes_research_intent": "no",
        "cost_tradeoffs": "Narrows the conclusion to what the reported design and uncertainty support.",
        "effort_scope": "section",
        "minimum_action": "Revise the title, abstract, and results to describe a nonrandomized observational comparison and remove definitive causal or eliminative language; report the interval-spanning-zero uncertainty alongside the estimate.",
        "no_honest_reason": null,
        "proposed_result_values": false,
        "requires_new_data": false,
        "status": "available"
      },
      "scholarly_relevance": "The stated conclusion is stronger than the available design and statistical uncertainty support."
    },
    {
      "criterion_ids": [
        "field.computing.transparency"
      ],
      "evidence_anchor": {
        "claim": "The limitations omit allocation bias, analytic flexibility, and imprecision, although allocation alternated by enrollment order and the comparison was selected after outcome distributions were viewed.",
        "locator": "manuscript.methods; manuscript.limitations"
      },
      "finding_id": "F2",
      "predicted_severity": "major",
      "predicted_venue_alignment": "not_claimed",
      "remedy": {
        "changes_research_intent": "no",
        "cost_tradeoffs": "Makes the study's constraints visible and may reduce the apparent certainty of its conclusions.",
        "effort_scope": "section",
        "minimum_action": "Add a limitations discussion addressing nonrandom allocation, outcome-informed analytic choice, and imprecision, and state how these constraints limit interpretation.",
        "no_honest_reason": null,
        "proposed_result_values": false,
        "requires_new_data": false,
        "status": "available"
      },
      "scholarly_relevance": "Readers need these design and analytic constraints to judge credibility and interpretability."
    }
  ],
  "item_id": "RCV-02",
  "profile": {
    "resolved_digest": "16c2281db5d31ff61c3d2eeaf876eda210d2e23bd558b3f8e0afcd210e958f28",
    "selected_criterion_ids": [
      "official.example.format",
      "official.example.scope",
      "field.computing.transparency",
      "broad.synthetic.claims"
    ]
  },
  "role": "INTERNAL",
  "schema_version": "review-criteria-subject-output/1.0"
}
