{
  "applicability": [
    {
      "criterion_id": "field.computing.transparency",
      "predicted": "applicable",
      "rationale": "The report is a systematic review and its methods documentation is directly relevant to transparency."
    },
    {
      "criterion_id": "overlay.prisma.flow",
      "predicted": "applicable",
      "rationale": "The declared reporting overlay applies to the systematic-review flow information described in the manuscript."
    },
    {
      "criterion_id": "broad.synthetic.claims",
      "predicted": "not_applicable",
      "rationale": "The supplied record does not identify a materially unsupported synthetic claim."
    }
  ],
  "consumer_id": "external_panel",
  "findings": [
    {
      "criterion_ids": [
        "field.computing.transparency",
        "overlay.prisma.flow"
      ],
      "evidence_anchor": {
        "claim": "The manuscript omits full-text exclusion counts and reasons, although the retained screening log contains them.",
        "locator": "manuscript.methods"
      },
      "finding_id": "F1",
      "predicted_severity": "major",
      "predicted_venue_alignment": "not_claimed",
      "remedy": {
        "changes_research_intent": "no",
        "cost_tradeoffs": "Requires extracting and documenting retained log details; no new screening is needed.",
        "effort_scope": "section",
        "minimum_action": "Report the full-text exclusion counts and reasons from the retained screening log in the review-flow documentation.",
        "no_honest_reason": null,
        "proposed_result_values": false,
        "requires_new_data": false,
        "status": "available"
      },
      "scholarly_relevance": "Omitting recoverable full-text exclusion information prevents readers from fully auditing how the included evidence set was derived."
    }
  ],
  "item_id": "RCV-04",
  "profile": {
    "resolved_digest": "53bcebea02310d2570d15058eee8b9d2bf1a0a9a3889b65ef1ec80b32696eee0",
    "selected_criterion_ids": [
      "field.computing.transparency",
      "overlay.prisma.flow",
      "broad.synthetic.claims"
    ]
  },
  "role": "R1",
  "schema_version": "review-criteria-subject-output/1.0"
}
