{
  "applicability": [
    {
      "criterion_id": "official.example.format",
      "predicted": "applicable",
      "rationale": "It is selected for submission readiness, though the supplied manuscript record provides no format-specific detail to assess compliance."
    },
    {
      "criterion_id": "official.example.scope",
      "predicted": "applicable",
      "rationale": "It is selected for venue fit; the abstract states that the article is within the declared journal scope."
    },
    {
      "criterion_id": "field.computing.transparency",
      "predicted": "applicable",
      "rationale": "The reported outcome-selection rule and its disclosure bear directly on transparency."
    },
    {
      "criterion_id": "broad.synthetic.claims",
      "predicted": "applicable",
      "rationale": "The claim that a fastest-trial estimate represents routine use bears on the support for stated conclusions."
    }
  ],
  "consumer_id": "external_panel",
  "findings": [
    {
      "criterion_ids": [
        "field.computing.transparency",
        "broad.synthetic.claims"
      ],
      "evidence_anchor": {
        "claim": "The analysis reports only each participant's fastest trial, discloses that rule only in the discussion, and does not report an all-trials sensitivity analysis despite the records being available.",
        "locator": "manuscript.methods; manuscript.results"
      },
      "finding_id": "F1",
      "predicted_severity": "major",
      "predicted_venue_alignment": "aligned",
      "remedy": {
        "changes_research_intent": "no",
        "cost_tradeoffs": "Re-analysis may alter the strength or interpretation of the reported conclusion.",
        "effort_scope": "re_analysis",
        "minimum_action": "Disclose and justify the selection rule in the methods, analyze all available trials as a sensitivity analysis, and revise any routine-use interpretation to reflect the resulting evidence.",
        "no_honest_reason": null,
        "proposed_result_values": false,
        "requires_new_data": false,
        "status": "available"
      },
      "scholarly_relevance": "Selecting the fastest observation per participant can bias the reported estimate, and delayed disclosure prevents readers from assessing that consequence. The stated scope alignment is separable from this validity defect."
    }
  ],
  "item_id": "RCV-03",
  "profile": {
    "resolved_digest": "16c2281db5d31ff61c3d2eeaf876eda210d2e23bd558b3f8e0afcd210e958f28",
    "selected_criterion_ids": [
      "official.example.format",
      "official.example.scope",
      "field.computing.transparency",
      "broad.synthetic.claims"
    ]
  },
  "role": "EIC",
  "schema_version": "review-criteria-subject-output/1.0"
}
