{
  "applicability": [
    {
      "criterion_id": "official.example.format",
      "predicted": "applicable",
      "rationale": "The manuscript presents a submission package with abstract, methods, results, limitations, and data-availability material."
    },
    {
      "criterion_id": "official.example.scope",
      "predicted": "applicable",
      "rationale": "The manuscript describes a synthetic workplace empirical contribution, so the declared synthetic track-scope criterion bears on it."
    },
    {
      "criterion_id": "field.computing.transparency",
      "predicted": "applicable",
      "rationale": "The manuscript makes implementation- and analysis-dependent claims from a workplace comparison."
    },
    {
      "criterion_id": "broad.synthetic.claims",
      "predicted": "applicable",
      "rationale": "The abstract, title, and results make strong claims based on synthetic evidence."
    }
  ],
  "consumer_id": "internal_evaluator",
  "findings": [
    {
      "criterion_ids": [
        "field.computing.transparency",
        "broad.synthetic.claims"
      ],
      "evidence_anchor": {
        "claim": "The manuscript claims a definitive causal effect despite alternating enrollment allocation, outcome-informed analytic choice, a confidence interval including zero, and no discussion of allocation bias, analytic flexibility, or imprecision.",
        "locator": "Abstract; Title; Methods; Results; Limitations"
      },
      "finding_id": "F1",
      "predicted_severity": "major",
      "predicted_venue_alignment": "not_claimed",
      "remedy": {
        "changes_research_intent": "no",
        "cost_tradeoffs": "This preserves the observational comparison but materially narrows the conclusion; fuller disclosure may reduce the apparent certainty and generality of the contribution.",
        "effort_scope": "other",
        "minimum_action": "Revise the title, abstract, results, and conclusions to describe an observational association rather than causation; disclose the alternating allocation and outcome-informed analytic decision; and add a limitations discussion of allocation bias, analytic flexibility, and imprecision. If feasible, provide a clearly specified sensitivity analysis, without presenting it as resolving causal identification.",
        "no_honest_reason": null,
        "proposed_result_values": false,
        "requires_new_data": false,
        "status": "available"
      },
      "scholarly_relevance": "Alternating allocation can confound the comparison, and selecting an analysis after inspecting outcomes compromises interpretability. The interval including zero also does not support definitive language. Transparent reporting and proportionate claims are necessary for readers to assess what the synthetic evidence can establish."
    }
  ],
  "item_id": "RCV-02",
  "profile": {
    "resolved_digest": "16c2281db5d31ff61c3d2eeaf876eda210d2e23bd558b3f8e0afcd210e958f28",
    "selected_criterion_ids": [
      "official.example.format",
      "official.example.scope",
      "field.computing.transparency",
      "broad.synthetic.claims"
    ]
  },
  "role": "INTERNAL",
  "schema_version": "review-criteria-subject-output/1.0"
}
