{
  "applicability": [
    {
      "criterion_id": "official.example.format",
      "predicted": "applicable",
      "rationale": "The manuscript is an empirical research article, though the supplied record does not provide formatting details."
    },
    {
      "criterion_id": "official.example.scope",
      "predicted": "applicable",
      "rationale": "The manuscript concerns learning analytics in classroom settings."
    },
    {
      "criterion_id": "field.computing.transparency",
      "predicted": "applicable",
      "rationale": "The manuscript presents an interpretable model and reports feature definitions and code."
    },
    {
      "criterion_id": "field.education.context",
      "predicted": "applicable",
      "rationale": "The manuscript makes a pooled conclusion across classroom settings with differing implementation."
    },
    {
      "criterion_id": "broad.synthetic.claims",
      "predicted": "applicable",
      "rationale": "The manuscript advances a cross-site conclusion that should remain supported by the reported evidence."
    }
  ],
  "consumer_id": "external_panel",
  "findings": [
    {
      "criterion_ids": [
        "field.education.context"
      ],
      "evidence_anchor": {
        "claim": "Classroom implementation differs by site, yet the main conclusion pools sites; the manuscript provides no site-specific calibration table and does not connect institutional variation to interpretation of the pooled result.",
        "locator": "methods; results; limitations"
      },
      "finding_id": "F1",
      "predicted_severity": "major",
      "predicted_venue_alignment": "not_claimed",
      "remedy": {
        "changes_research_intent": "no",
        "cost_tradeoffs": "Requires additional site-level analysis and a more qualified interpretation of the pooled conclusion.",
        "effort_scope": "re_analysis",
        "minimum_action": "Report site-specific calibration and explain how documented site-level implementation differences condition interpretation of the pooled conclusion.",
        "no_honest_reason": null,
        "proposed_result_values": false,
        "requires_new_data": false,
        "status": "available"
      },
      "scholarly_relevance": "Without site-level calibration and contextual interpretation, similar discrimination across sites does not adequately establish that the pooled conclusion carries the same meaning across the reported classroom settings."
    }
  ],
  "item_id": "RCV-05",
  "profile": {
    "resolved_digest": "f92c2213d26eec2cf77eb3a6b4036dd441c712d4c399f19acdb11d134543ebc8",
    "selected_criterion_ids": [
      "official.example.format",
      "official.example.scope",
      "field.computing.transparency",
      "field.education.context",
      "broad.synthetic.claims"
    ]
  },
  "role": "R3",
  "schema_version": "review-criteria-subject-output/1.0"
}
