{
  "applicability": [
    {
      "criterion_id": "official.example.format",
      "predicted": "not_applicable",
      "rationale": "The supplied manuscript record contains no submission-format details to assess."
    },
    {
      "criterion_id": "official.example.scope",
      "predicted": "applicable",
      "rationale": "The manuscript explicitly asserts that it is within the declared journal scope."
    },
    {
      "criterion_id": "field.computing.transparency",
      "predicted": "applicable",
      "rationale": "The record describes outcome selection and delayed disclosure of that rule."
    },
    {
      "criterion_id": "broad.synthetic.claims",
      "predicted": "applicable",
      "rationale": "The discussion makes a routine-use representativeness claim from selected records."
    }
  ],
  "consumer_id": "external_panel",
  "findings": [
    {
      "criterion_ids": [
        "field.computing.transparency"
      ],
      "evidence_anchor": {
        "claim": "Only each participant's fastest trial is reported, and the selection rule is disclosed only in the discussion.",
        "locator": "manuscript.methods; manuscript.results"
      },
      "finding_id": "F1",
      "predicted_severity": "major",
      "predicted_venue_alignment": "aligned",
      "remedy": {
        "changes_research_intent": "no",
        "cost_tradeoffs": "Requires re-analysis and clearer reporting, but the supplied records are available.",
        "effort_scope": "re_analysis",
        "minimum_action": "Disclose the selection rule in the methods and analyze all available trial records, clearly distinguishing that analysis from the selected-record analysis.",
        "no_honest_reason": null,
        "proposed_result_values": false,
        "requires_new_data": false,
        "status": "available"
      },
      "scholarly_relevance": "Undisclosed outcome selection impedes assessment of whether the reported inference reflects the available records."
    },
    {
      "criterion_ids": [
        "broad.synthetic.claims"
      ],
      "evidence_anchor": {
        "claim": "The discussion treats the fastest-trial estimate as representative of routine use, while an analysis using all trials is not reported.",
        "locator": "manuscript.limitations; manuscript.results"
      },
      "finding_id": "F2",
      "predicted_severity": "major",
      "predicted_venue_alignment": "aligned",
      "remedy": {
        "changes_research_intent": "no",
        "cost_tradeoffs": "May narrow the routine-use claim if it is not supported by analysis of all available records.",
        "effort_scope": "re_analysis",
        "minimum_action": "Assess the routine-use claim using all available trial records and revise the claim to match what that analysis supports.",
        "no_honest_reason": null,
        "proposed_result_values": false,
        "requires_new_data": false,
        "status": "available"
      },
      "scholarly_relevance": "A representativeness claim based solely on fastest records can overstate relevance to ordinary use."
    }
  ],
  "item_id": "RCV-03",
  "profile": {
    "resolved_digest": "16c2281db5d31ff61c3d2eeaf876eda210d2e23bd558b3f8e0afcd210e958f28",
    "selected_criterion_ids": [
      "official.example.format",
      "official.example.scope",
      "field.computing.transparency",
      "broad.synthetic.claims"
    ]
  },
  "role": "EIC",
  "schema_version": "review-criteria-subject-output/1.0"
}
